key,moment,caption,message,informational,link
post-01,2022/11/13 19:39,I'm happy!,Today is my first day of work!,false,https://www.youtube.com/watch?v=LpzW7qyCF3s
post-02,2022/11/09 15:55,Working,I'm the master of my room!,false,
post-03,2022/11/07 10:50,Listen!,Everyone need to wash their hands first!,true,https://concepto.de/higiene/
post-04,2022/11/12 05:00,Woa!,This app's so cool!,false,
post-05,2022/11/11 06:01,First time,How can I start cooking?,true,http://www.canalcocina.es
post-06,2022/11/10 19:30,Mmmmm,Is this working properly?,false,
post-07,2022/11/15 12:01,Remember,Clean the kitchen before leaving!,true,